college_name,rating,location,courses_offered,tution_fee,exams_accepted,highest_package
Forte Institute of Technology,4.2,UTTAR PRADESH,B.Tech / B.E.,Get Fee Details,UPSEE,
Regional College for Education Research & Technology,4.5,RAJASTHAN,B.Tech / B.E.,"₹2,80,000",-,
Siddhi Vinayak College of Science and Higher Education,3,RAJASTHAN,B.Tech / B.E.,Get Fee Details,JEE Main,
Sri Balaji College of Engineering and Technology,4.2,RAJASTHAN,B.Tech / B.E.,Get Fee Details,JEE Main,9
"Radha Govind University ,Ramgarh",4.2,JHARKHAND,B.Tech / B.E.,"₹2,00,000",-,
Jawaharlal College of Engineering and Technology,4,KERALA,B.Tech / B.E.,"₹2,00,000",-,
"Vishveshwarya Institute of Technology ,Noida",4.2,UTTAR PRADESH,B.Tech / B.E.,"₹2,20,000",-,
Mahatma Gandhi Institute of Engineering & Management,2,MADHYA PRADESH,B.Tech / B.E.,Get Fee Details,PET Madhya Pradesh,
Excel Group of Insitutions,4.2,UTTAR PRADESH,B.Tech / B.E.,Get Fee Details,UPSEE,
Ranippettai Engineering College,4.2,TAMIL NADU,B.Tech / B.E.,Get Fee Details,-,
SR Group of Institutions,4,UTTAR PRADESH,B.Tech / B.E.,Get Fee Details,UPSEE,
Excel Group of Insitutions,4.2,UTTAR PRADESH,B.Tech / B.E.,Get Fee Details,UPSEE,
Forte Institute of Technology,4.2,UTTAR PRADESH,B.Tech / B.E.,Get Fee Details,UPSEE,
"Rashtrakavi Ramdhari Singh Dinkar College of Engineering ,Begusarai",4.2,BIHAR,B.Tech / B.E.,"₹10,500",-,
Government Polytechnic - Kanpur,4.7,UTTAR PRADESH,B.Tech / B.E.,"₹35,500",-,
Indian Institute of Science (IISc),4.2,KARNATAKA,B.Tech / B.E.,"₹8,00,000",-,
"Avvaiyar College of Engineering and Technology for Women ,Pondicherry",4.2,PUDUCHERRY,B.Tech / B.E.,"₹1,16,000",-,50
"Padmashri Dr. V.B. Kolte College of Engineering, Malkapur ,Maharashtra - Other",4.2,MAHARASHTRA,B.Tech / B.E.,"₹2,30,000",-,
Lucknow Institute of Technology,4,UTTAR PRADESH,B.Tech / B.E.,"₹2,20,000",UPSEE,
MP Institute of Management And Computer Application,4,UTTAR PRADESH,B.Tech / B.E.,Get Fee Details,UPSEE,
Modinagar Institute of Technology,5,UTTAR PRADESH,B.Tech / B.E.,Get Fee Details,UPSEE,
"Rao Pahlad Singh Group of Institutions ,Haryana - Other",4.2,HARYANA,B.Tech / B.E.,"₹1,99,000",-,
Darbhanga College of Engineering,3.9,BIHAR,B.Tech / B.E.,"₹1,17,000",-,
"Swamy Vivekananda Engineering College ,Vizianagaram",4.2,ANDHRA PRADESH,B.Tech / B.E.,"₹1,40,000",-,
Sunstone School of Technology,4.2,DELHI NCR,B.Tech / B.E.,Get Fee Details,-,
Seth Vishambhar Nath Institute of Engineering & Technology,4.2,UTTAR PRADESH,B.Tech / B.E.,Get Fee Details,UPSEE,
Subharti Institute of Technology & Engineering,5,UTTAR PRADESH,B.Tech / B.E.,Get Fee Details,JEE Main,
Woman Institute of Engineering & Technology,4.2,UTTAR PRADESH,B.Tech / B.E.,Get Fee Details,UPSEE,
"Rao Birender Singh State Institute of Engineering and Technology ,Rewari",4.2,HARYANA,B.Tech / B.E.,"₹1,20,000",-,
"University V.O.C. College of Engineering, Thoothukudi",4.2,TAMIL NADU,B.Tech / B.E.,"₹2,00,000",-,
"Bhargava College of Engineering and Technology ,Samba",4.2,JAMMU & KASHMIR,B.Tech / B.E.,"₹1,92,000",-,
"Quba College of Engineering and Technology (QCET) ,Nellore",4.2,ANDHRA PRADESH,B.Tech / B.E.,"₹1,40,000",-,
"Sri Venkateswara College of Engineering, Kanchipuram ,Kanchipuram, Chennai",4.2,TAMIL NADU,B.Tech / B.E.,"₹3,02,000",-,
"University College of Engineering, Panruti, Anna University ,Cuddalore",4.2,TAMIL NADU,B.Tech / B.E.,"₹2,00,000",-,
Institute of Information Technology & Management -MBA,5,MADHYA PRADESH,B.Tech / B.E.,Get Fee Details,PET Madhya Pradesh,
Sanghvi Institute of Management & Science,2.8,MADHYA PRADESH,B.Tech / B.E.,"₹4,40,000",PET Madhya Pradesh,6
"University of Technology ,Jaipur",4.2,RAJASTHAN,B.Tech / B.E.,"₹3,25,000",-,
"Bharath Educational Society Group of Insittutions ,Chittoor",4.2,ANDHRA PRADESH,B.Tech / B.E.,"₹1,40,000",-,8
"Shramshakti College of Agricultural Engineering ,Ahmednagar",4.2,MAHARASHTRA,B.Tech / B.E.,"₹2,80,000",-,
GH Raisoni Societys College of Engineering and Management,4.8,MAHARASHTRA,B.Tech / B.E.,Get Fee Details,-,
RC Patel Institute of Pharmaceutical Education & Research,4.5,MAHARASHTRA,B.Tech / B.E.,Get Fee Details,-,
Jawaharlal Nehru University (JNU),3.8,DELHI NCR,B.Tech / B.E.,"₹5,00,000",-,
Department of Computer Science & Application - Maharishi Dayanand University,4,HARYANA,B.Tech / B.E.,Get Fee Details,-,
School of Technology and Applied Science,4.2,KERALA,B.Tech / B.E.,Get Fee Details,-,
"University College of Technology, Osmania University ,Tarnaka, Hyderabad",4.2,TELANGANA,B.Tech / B.E.,"₹1,40,000",-,
"Bharath College of Engineering and Technology for Women ,Kadapa",4.2,ANDHRA PRADESH,B.Tech / B.E.,"₹1,40,000",-,4
The Kavery Engineering College,4.2,TAMIL NADU,B.Tech / B.E.,"₹2,00,000",-,
MAEERs Women Engineering College,4,MAHARASHTRA,B.Tech / B.E.,Get Fee Details,-,
Jamia Hamdard University,3.5,DELHI NCR,B.Tech / B.E.,"₹6,40,000",-,
Dayanand Dinanath Group of Institutions,5,UTTAR PRADESH,B.Tech / B.E.,Get Fee Details,-,
"Shramshakti College of Agricultural Engineering ,Ahmednagar",4.2,MAHARASHTRA,B.Tech / B.E.,"₹2,80,000",-,
"Al-Ameen Engineering College ,Palakkad",4.2,TAMIL NADU,B.Tech / B.E.,"₹1,78,000",-,9
"Chhattisgarh College of Agricultural Engineering ,Durg",4.2,CHATTISGARH,B.Tech / B.E.,"₹1,50,000",-,
Sree Sastha College of Engineering,3,TAMIL NADU,B.Tech / B.E.,Get Fee Details,TNEA,
"Shivajirao S. Jondhale College of Engineering and Technology ,Asangaon, Mumbai",4.2,MAHARASHTRA,B.Tech / B.E.,"₹3,38,000",-,
Saroj Mohan Institute of Technology,2.5,WEST BENGAL,B.Tech / B.E.,Get Fee Details,WBJEE,
Knowledge Institute of Technology,5,TAMIL NADU,B.Tech / B.E.,"₹60,000",TNEA,
Shri Shankaracharya Institute of Technology & Management,5,CHATTISGARH,B.Tech / B.E.,Get Fee Details,-,
Dr AS College of Agricultural Engineering,4.2,MAHARASHTRA,B.Tech / B.E.,Get Fee Details,-,12
"Dr. Sau. Kamaltai Gawai Institute of Engineering and Technology ,Amravati",4.2,MAHARASHTRA,B.Tech / B.E.,"₹2,52,000",-,
ARM College of Engineering and Technology,3.5,TAMIL NADU,B.Tech / B.E.,"₹1,60,000",TNEA,
Sri Nagoji rao Institute of Technology and Science (Women),4.2,ANDHRA PRADESH,B.Tech / B.E.,Get Fee Details,AP EAMCET,
Apollo Engineering College,3.8,TAMIL NADU,B.Tech / B.E.,"₹3,40,000",TNEA,
School of Planning & Architecture - Jawaharlal Nehru Architecture and Fine Arts University,4.1,TELANGANA,B.Tech / B.E.,Get Fee Details,AP EAMCET,9
"Shivani Engineering College ,Tiruchirappalli",4.2,TAMIL NADU,B.Tech / B.E.,"₹2,00,000",-,
"Younus College of Engineering and Technology ,Kollam",4.2,KERALA,B.Tech / B.E.,"₹2,00,000",-,
Rewa Engineering College - REC,0,MADHYA PRADESH,B.Tech / B.E.,"₹1,90,500",-,30
Jain Vishva Bharati Institute - Ladnun Rajasthan,4.7,RAJASTHAN,B.Tech / B.E.,"₹3,500",-,
Teelaga Krishna Reddy Engineering College,4.2,TELANGANA,B.Tech / B.E.,Get Fee Details,AP EAMCET,
Saroj Mohan Institute of Technology,2.5,WEST BENGAL,B.Tech / B.E.,Get Fee Details,WBJEE,
Jamia Hamdard University,3.5,DELHI NCR,B.Tech / B.E.,"₹6,40,000",-,
RC Patel Institute of Pharmaceutical Education & Research,4.5,MAHARASHTRA,B.Tech / B.E.,Get Fee Details,-,
"Shri Ram College of Information Technology ,Morena",4.2,MADHYA PRADESH,B.Tech / B.E.,Get Fee Details,-,
"College of Agricultural Engineering and Technology, Dapoli ,Ratnagiri",4.2,BIHAR,B.Tech / B.E.,Get Fee Details,-,
Infant Jesus College of Engineering,3,TAMIL NADU,B.Tech / B.E.,Get Fee Details,-,
Sree Sastha College of Engineering,3,TAMIL NADU,B.Tech / B.E.,Get Fee Details,TNEA,
Vivekanand Institute of Professional Studies (VIPS),3.7,DELHI NCR,B.Tech / B.E.,"₹5,33,000",-,
DJ College of Engineering and Technology (DJCET),3.5,UTTAR PRADESH,B.Tech / B.E.,Get Fee Details,JEE Main,7
Siddhi Vinayak Engenering & Management College,4.2,RAJASTHAN,B.Tech / B.E.,Get Fee Details,JEE Main,
"Shri Pillappa College of Engineering ,Hessarghatta Road, Bangalore",4.2,KARNATAKA,B.Tech / B.E.,"₹2,38,500",-,
Graphic Era Hill University,4.2,UTTARAKHAND,B.Tech / B.E.,"₹9,68,000",-,
Bharati Vidyapeeth's College of Engineering for Women,4,MAHARASHTRA,B.Tech / B.E.,"₹4,10,500",-,
Indra Ganesan College of Engineering,4,TAMIL NADU,B.Tech / B.E.,Get Fee Details,-,
Sanjay Education Society's College of Engineering,4.2,MAHARASHTRA,B.Tech / B.E.,"₹1,72,000",-,
Dayanand Dinanath Group of Institutions,5,UTTAR PRADESH,B.Tech / B.E.,Get Fee Details,-,
"Shri Phanishwar Nath Renu Engineering College, Araria ,Bihar - Other",4.2,BIHAR,B.Tech / B.E.,Get Fee Details,-,
Jagruti Institute of Engineering and Technology (JIET),4,TELANGANA,B.Tech / B.E.,Get Fee Details,AP EAMCET,
Hardayal Technical Campus,4.2,UTTAR PRADESH,B.Tech / B.E.,Get Fee Details,UPSEE,
Teelaga Krishna Reddy Engineering College,4.2,TELANGANA,B.Tech / B.E.,Get Fee Details,AP EAMCET,
ARM College of Engineering and Technology,3.5,TAMIL NADU,B.Tech / B.E.,"₹1,60,000",TNEA,
"Sree Narayana Guru College of Engineering And Technology ,Kannur",4.2,KARNATAKA,B.Tech / B.E.,"₹2,00,000",-,
"Aklia Group of Institutions ,Bathinda",4.2,PUNJAB,B.Tech / B.E.,"₹3,09,000",-,26
Govt College of Engineering & Textile Technology,4.2,WEST BENGAL,B.Tech / B.E.,"₹58,000",-,
Mahatma Jyoti Rao Phoole University,1,RAJASTHAN,B.Tech / B.E.,Get Fee Details,-,
Mahaveer Swami Institute of Technology,4.2,HARYANA,B.Tech / B.E.,Get Fee Details,JEE Main,5
Akshaya Bharathi Institute of Technology,4.2,ANDHRA PRADESH,B.Tech / B.E.,Get Fee Details,AP EAMCET,
"Sree Ernakulathappan college of engineering and Management ,Kerala - Other",4.2,KERALA,B.Tech / B.E.,"₹1,00,000",-,
"Avvaiyar College of Engineering and Technology for Women ,Pondicherry",4.2,PUDUCHERRY,B.Tech / B.E.,"₹1,16,000",-,50
Surya School of Planning & Engineering,4.2,UTTAR PRADESH,B.Tech / B.E.,"₹2,19,500",-,
Madhav University,0,RAJASTHAN,B.Tech / B.E.,Get Fee Details,-,
Dev Bhoomi Group of Institutions (DBGI Saharanpur),4.2,UTTAR PRADESH,B.Tech / B.E.,"₹2,20,000",-,
Chaitanya Engineering College,4,ANDHRA PRADESH,B.Tech / B.E.,Get Fee Details,AP EAMCET,
CRV Institute of Technology and Science,4.2,TELANGANA,B.Tech / B.E.,Get Fee Details,AP EAMCET,
Chadalawada Ramanamma Engineering College,4,ANDHRA PRADESH,B.Tech / B.E.,Get Fee Details,AP EAMCET,
"Sree Chaitanya Institute of Technological Sciences (SCITS) ,Karimnagar",4.2,TELANGANA,B.Tech / B.E.,"₹2,06,000",-,
Chaitanya Engineering College,4,ANDHRA PRADESH,B.Tech / B.E.,Get Fee Details,AP EAMCET,
CRV Institute of Technology and Science,4.2,TELANGANA,B.Tech / B.E.,Get Fee Details,AP EAMCET,
Chadalawada Ramanamma Engineering College,4,ANDHRA PRADESH,B.Tech / B.E.,Get Fee Details,AP EAMCET,
Abhinav Hi-Tech College Of Engineering & Technology,4,TELANGANA,B.Tech / B.E.,Get Fee Details,AP EAMCET,
"Government College of Engineering and Technology, Safapora Ganderbal ,Bandipora",4.2,JAMMU & KASHMIR,B.Tech / B.E.,"₹1,05,000",-,
"Avanthi's Research and Technological Academy ,Andhra Pradesh - Other",4.2,ANDHRA PRADESH,B.Tech / B.E.,"₹1,57,000",-,17
Asian Institute of Engineering & Technology,4.2,UTTAR PRADESH,B.Tech / B.E.,"₹84,000",-,
Viswa Bharathi College of Engineering,4.2,TELANGANA,B.Tech / B.E.,Get Fee Details,AP EAMCET,
Jagruti Institute of Engineering and Technology (JIET),4,TELANGANA,B.Tech / B.E.,Get Fee Details,AP EAMCET,
MVR College of Engineering and Technology,0,ANDHRA PRADESH,B.Tech / B.E.,Get Fee Details,AP EAMCET,
Nalgonda Institute of Technology & Science (NITS),4.2,ANDHRA PRADESH,B.Tech / B.E.,Get Fee Details,AP EAMCET,
"Dr. Lankapalli Bullayya College ,Visakhapatnam",4.2,ANDHRA PRADESH,B.Tech / B.E.,"₹1,40,000",-,
"Swetha Institute Of Technology and Science ,Tirupati",4.2,ANDHRA PRADESH,B.Tech / B.E.,"₹1,40,000",-,
"College of Agriculture, Mul-Maroda - Dr Panjabrao Deshmukh Krishi Vidyapeeth ,Maharashtra - Other",4.2,MAHARASHTRA,B.Tech / B.E.,Get Fee Details,-,
Tudi Narasimha Reddy Institution of Technology & Sciences,4.2,TELANGANA,B.Tech / B.E.,Get Fee Details,AP EAMCET,
Usha Rama College of Engineering And Technology,3.7,ANDHRA PRADESH,B.Tech / B.E.,Get Fee Details,AP EAMCET,
Jagannath Institute for Technology and Management,5,ODISHA,B.Tech / B.E.,Get Fee Details,JEE Main,
School of Engineering and Technology,4.2,ODISHA,B.Tech / B.E.,Get Fee Details,-,
Sri Raja Rajeshwari Engineering College,1.5,KARNATAKA,B.Tech / B.E.,Get Fee Details,AP EAMCET,
Orissa Engineering College,3.5,ODISHA,B.Tech / B.E.,"₹2,84,000",-,
Jain Vishva Bharati Institute - Ladnun Rajasthan,4.7,RAJASTHAN,B.Tech / B.E.,"₹3,500",-,
International College of Engineering,4.2,UTTAR PRADESH,B.Tech / B.E.,"₹2,20,000",UPSEE,16
JECRC UDML College of Engineering,2.9,RAJASTHAN,B.Tech / B.E.,Get Fee Details,JEE Main,
Tudi Narasimha Reddy Institution of Technology & Sciences,4.2,TELANGANA,B.Tech / B.E.,Get Fee Details,AP EAMCET,
"University College of Technology, Osmania University ,Tarnaka, Hyderabad",4.2,TELANGANA,B.Tech / B.E.,"₹1,40,000",-,
"BFIT Group of Institutions ,Dehradun",4.2,UTTARAKHAND,B.Tech / B.E.,"₹3,93,000",-,
Technical Education College,4.2,PUNJAB,B.Tech / B.E.,Get Fee Details,-,
Jind Institute of Engineering & Technology,4.2,HARYANA,B.Tech / B.E.,"₹2,36,500",-,
KLR College of Engineering & Technology,3,ANDHRA PRADESH,B.Tech / B.E.,Get Fee Details,AP EAMCET,
Vemu Institute of Technology (VEMU),4,ANDHRA PRADESH,B.Tech / B.E.,Get Fee Details,AP EAMCET,
Amrita Sai Institute of Science and Technology,4.2,ANDHRA PRADESH,B.Tech / B.E.,"₹2,01,000",AP EAMCET,10
"University College of Engineering, Panruti, Anna University ,Cuddalore",4.2,TAMIL NADU,B.Tech / B.E.,"₹2,00,000",-,
"Bengal Institute of Technology and Management ,Birbhum",4.2,WEST BENGAL,B.Tech / B.E.,"₹3,56,000",-,21
Vidya Vardhaka College of Commerce & Business Management,5,KARNATAKA,B.Tech / B.E.,"₹4,03,000",-,
"Anakapalle Merchants Association Konathala Subrahmanyam and Immedisetty Kanakaraju College of Technology and Management ,Visakhapatnam",4.2,ANDHRA PRADESH,B.Tech / B.E.,"₹1,40,000",-,
MGM College,4.5,UTTAR PRADESH,B.Tech / B.E.,"₹2,19,500",-,
Jogaiah Institute of Technology & Sciences,4.2,ANDHRA PRADESH,B.Tech / B.E.,Get Fee Details,AP EAMCET,
Mentey Padmanabham College of Engineering & Technology,5,ANDHRA PRADESH,B.Tech / B.E.,Get Fee Details,AP EAMCET,
Odisha School of Business Management,4.2,ODISHA,B.Tech / B.E.,Get Fee Details,-,
"University College of Engineering, Nagercoil, Anna University",4.2,TAMIL NADU,B.Tech / B.E.,"₹2,00,000",-,
"Thejus Engineering College ,Thrissur",4.2,KERALA,B.Tech / B.E.,"₹2,03,500",-,
"Baba Mangal Singh Institute of Management and Technology ,Moga",4.2,PUNJAB,B.Tech / B.E.,Get Fee Details,-,
Rishi Chadha Visvas Girls Institute of Technology,4,UTTAR PRADESH,B.Tech / B.E.,"₹1,29,000",-,
Institute of Technology and Management - Gorakhpur,4,UTTAR PRADESH,B.Tech / B.E.,Get Fee Details,-,
"Techno India,Balurghat ,West Bengal - Other",4.2,WEST BENGAL,B.Tech / B.E.,"₹3,32,000",-,
International College of Engineering,4.2,UTTAR PRADESH,B.Tech / B.E.,"₹2,20,000",UPSEE,16
Ganga Technical Campus,3.7,HARYANA,B.Tech / B.E.,"₹2,69,500",JEE Main,
College of Basic Sciences & Humanities,4.2,UTTARAKHAND,B.Tech / B.E.,Get Fee Details,JEE Main,
"B. P. Mandal College of Engineering ,Madhepura",4.2,BIHAR,B.Tech / B.E.,"₹80,000",-,17
Regency Institute of Management & Technology,4.2,UTTAR PRADESH,B.Tech / B.E.,"₹1,57,000",-,
Dr Radhakrishnan Institute of Technology,4.2,RAJASTHAN,B.Tech / B.E.,"₹2,69,000",-,
MRK Institute of Engineering & Technology,4.2,HARYANA,B.Tech / B.E.,Get Fee Details,-,
Stallion College for Engineering and Technology,4.2,UTTAR PRADESH,B.Tech / B.E.,Get Fee Details,UPSEE,
Axis Institute of Planning & Management,2,UTTAR PRADESH,B.Tech / B.E.,Get Fee Details,UPSEE,
Desh Bhagat Foundation Groups of Institutions - Moga,4,PUNJAB,B.Tech / B.E.,Get Fee Details,-,
"Techno International Batanagar ,Maheshtala, Kolkata",4.2,WEST BENGAL,B.Tech / B.E.,"₹5,50,000",-,
"Cochin College of Engineering and Technology, Malappuram",4.2,KERALA,B.Tech / B.E.,"₹1,71,500",-,70
Mekapati Rajamohan Reddy Institute of Technology & Science (MeRITS),4.5,ANDHRA PRADESH,B.Tech / B.E.,"₹1,42,000",-,
"International Institute of Technology & Business ,Sonepat",4.2,HARYANA,B.Tech / B.E.,"₹2,62,000",-,7
Institute of Technology & Sciences,4.2,HARYANA,B.Tech / B.E.,Get Fee Details,-,
Sal College of Engineering,1.5,GUJARAT,B.Tech / B.E.,"₹3,04,000",JEE Main,13
Shri Ram College of Engineering & Management,4.2,HARYANA,B.Tech / B.E.,Get Fee Details,-,
Institute of Technology & Sciences,4.2,HARYANA,B.Tech / B.E.,Get Fee Details,-,
MRK Institute of Engineering & Technology,4.2,HARYANA,B.Tech / B.E.,Get Fee Details,-,
"Wellfare Institute of Science Technology and Management ,Visakhapatnam",4.2,ANDHRA PRADESH,B.Tech / B.E.,"₹1,40,000",-,
"Cauvery Institute of Technology ,Mandya",4.2,KARNATAKA,B.Tech / B.E.,"₹3,60,000",-,11
"GNDEC - Guru Nanak Dev Engineering College ,Bidar",4.2,KARNATAKA,B.Tech / B.E.,"₹3,60,000",-,20
"KJ's Educational Institute ,Kondhwa, Pune",4.2,MAHARASHTRA,B.Tech / B.E.,"₹3,31,000",-,
Himalayan Institute of Technology,4.2,UTTARAKHAND,B.Tech / B.E.,Get Fee Details,-,
Rayat Bahra College of Engineering & Nano Technology For Women,4.2,PUNJAB,B.Tech / B.E.,Get Fee Details,-,
PDM School of Technology & Management,3,HARYANA,B.Tech / B.E.,Get Fee Details,-,
Pt LR college of Technology,4.2,HARYANA,B.Tech / B.E.,"₹2,40,000",JEE Main,
"Walchand Institute of Technology ,Solapur",4.2,MAHARASHTRA,B.Tech / B.E.,"₹4,39,500",-,
"Canara Engineering College ,Mangalore",4.2,KARNATAKA,B.Tech / B.E.,"₹3,68,000",-,8
Bishamber Sahai Law Institute,4,UTTARAKHAND,B.Tech / B.E.,"₹1,13,500",-,
Aditya Silver Oak Institute of Technology,4.7,GUJARAT,B.Tech / B.E.,"₹3,20,000","JEE Main, 12th Board",12
Ludhiana Group of Colleges - Chowk Chaukiman,4,PUNJAB,B.Tech / B.E.,"₹80,000",-,
Bharat Institute of Engineering & Technology - Mansa,4,PUNJAB,B.Tech / B.E.,Get Fee Details,CET Punjab,
Chhatrapati Shahuji Maharaj Group of Institutions,4.2,UTTAR PRADESH,B.Tech / B.E.,Get Fee Details,UPSEE,
"Wainganga College of Engineering and Management ,Nagpur",4.2,MAHARASHTRA,B.Tech / B.E.,"₹3,52,000",-,
"Rathinam Institute of Technology, Bengaluru, Powered by Sunstone",4.2,KARNATAKA,B.Tech / B.E.,"₹6,20,000",-,
"Elizabeth College of Engineering and Technology ,Tamil Nadu - Other",4.2,TAMIL NADU,B.Tech / B.E.,"₹2,00,000",-,24
"Institute of Computer Technology, Ganpat University ,Mehsana",4.2,GUJARAT,B.Tech / B.E.,"₹4,64,000",-,
Vidya Varti College,4,MAHARASHTRA,B.Tech / B.E.,Get Fee Details,-,
Uka Tarsadia University,4.2,GUJARAT,B.Tech / B.E.,"₹2,48,000",-,
Naraini Group of Institutions,4.2,HARYANA,B.Tech / B.E.,Get Fee Details,-,
Rathinam Technical Campus powered by Sunstone,4.2,TAMIL NADU,B.Tech / B.E.,"₹16,00,000",-,
"College of Agricultural Engineering and Technology, Junagadh Agricultural University",4.2,GUJARAT,B.Tech / B.E.,"₹68,000",-,
Surya School of Architecture,4.2,TAMIL NADU,B.Tech / B.E.,"₹2,00,000",-,
All India Shri Shivaji Memorial Society’s College Of Engineering,4,MAHARASHTRA,B.Tech / B.E.,Get Fee Details,-,
JS Institute of Management & Technology,3,UTTAR PRADESH,B.Tech / B.E.,Get Fee Details,UPSEE,
Shree Siddhivinayak Groups of Institutions,5,HARYANA,B.Tech / B.E.,Get Fee Details,-,
Bharat Group of Colleges,4.2,PUNJAB,B.Tech / B.E.,"₹2,80,000",CET Punjab,12
GNIT Girls Institute of Technology,2,UTTAR PRADESH,B.Tech / B.E.,Get Fee Details,UPSEE,
"Uttrakhand Technical University, Dehradun",4.2,UTTARAKHAND,B.Tech / B.E.,Get Fee Details,-,
"College of Agricultural Engineering and Technology, Dapoli ,Ratnagiri",4.2,BIHAR,B.Tech / B.E.,Get Fee Details,-,
Grow More School of Architecture,4.2,GUJARAT,B.Tech / B.E.,"₹2,00,000",-,
Bhabha Group of Institutions,4,UTTAR PRADESH,B.Tech / B.E.,Get Fee Details,UPSEE,
Millia Institute of Technology,4.2,UTTAR PRADESH,B.Tech / B.E.,Get Fee Details,BCECE,
Translam Institute of Technology and Management (TITM),4.2,UTTAR PRADESH,B.Tech / B.E.,Get Fee Details,UPSEE,
Bhabha Group of Institutions,4,UTTAR PRADESH,B.Tech / B.E.,Get Fee Details,UPSEE,
JS Institute of Management & Technology,3,UTTAR PRADESH,B.Tech / B.E.,Get Fee Details,UPSEE,
Shree Ganesh Group of Institutions,4.2,PUNJAB,B.Tech / B.E.,Get Fee Details,CET Punjab,
"Dnyanshree Institute of Engineering and Technology ,Satara",4.2,MAHARASHTRA,B.Tech / B.E.,"₹3,52,000",-,
Akshaya College of Engineering & Technology,4.2,TAMIL NADU,B.Tech / B.E.,"₹2,00,000",-,
Sanghavi Institute of Management & Science,2,MADHYA PRADESH,B.Tech / B.E.,Get Fee Details,-,
Chankya Technical Campus,4.2,RAJASTHAN,B.Tech / B.E.,Get Fee Details,"RPET, JEE Main",
King's Group of Institutions,4.2,PUNJAB,B.Tech / B.E.,Get Fee Details,-,
Surya Group of Institutions,4,UTTAR PRADESH,B.Tech / B.E.,Get Fee Details,UPSEE,
"DMV Mandals College of Agriculture and Bio-Technology ,Aurangabad",4.2,MAHARASHTRA,B.Tech / B.E.,Get Fee Details,-,6
"KDK's Smt. Rajashree Mulak College of Engineering for Women ,Nagpur",4.2,MAHARASHTRA,B.Tech / B.E.,"₹1,20,000",-,
"N.C. College of Engineering ,Panipat",4.2,HARYANA,B.Tech / B.E.,"₹3,10,000",-,
St Soldier Institute of Enginnering And Technology,4.2,PUNJAB,B.Tech / B.E.,"₹2,46,000",-,
MBS College of Engineering & Technology,3.3,JAMMU & KASHMIR,B.Tech / B.E.,"₹1,80,000",-,
PK Institute of Technology & Management (PKITM),4,UTTAR PRADESH,B.Tech / B.E.,Get Fee Details,UPSEE,
Brahmanand Institute of Research Technology & Management (BIRTM),5,HARYANA,B.Tech / B.E.,Get Fee Details,UPSEE,
JIET School of Engineering & Technology for Girls ( JIET - SOMG),4,RAJASTHAN,B.Tech / B.E.,Get Fee Details,"RPET, JEE Main",
JIET School of Engineering & Technology for Girls ( JIET - SOMG),4,RAJASTHAN,B.Tech / B.E.,Get Fee Details,"RPET, JEE Main",
"Phonics School Of Engineering and Business Administration ,Haridwar",4.2,UTTARAKHAND,B.Tech / B.E.,Get Fee Details,-,
"Indala College of Engineering ,Thane",4.2,MAHARASHTRA,B.Tech / B.E.,Get Fee Details,-,
Oriental Institute of Science & Technology,4.2,MADHYA PRADESH,B.Tech / B.E.,Get Fee Details,PET Madhya Pradesh,
Millia Institute of Technology,4.2,UTTAR PRADESH,B.Tech / B.E.,Get Fee Details,BCECE,
RP Sharma Institute of Technology,3.8,BIHAR,B.Tech / B.E.,Get Fee Details,BCECE,
Guru Gobind Singh Educational Society's Technical Campus (GGSESTC),3.8,JHARKHAND,B.Tech / B.E.,Get Fee Details,Highest Package,
Shankara Institute of Technology,1.5,RAJASTHAN,B.Tech / B.E.,Get Fee Details,"RPET, JEE Main",12
"Perunthalaivar Kamarajar Institute of Engineering and Technology ,Pondicherry",4.2,PUDUCHERRY,B.Tech / B.E.,"₹1,11,000",-,
Krishnaveni Institute of Technology,4.2,TELANGANA,B.Tech / B.E.,"₹1,40,000",-,
Mahatma Gandhi Institute of Engineering & Management,2,MADHYA PRADESH,B.Tech / B.E.,Get Fee Details,PET Madhya Pradesh,
Continental College of Higher Studies,4.2,PUNJAB,B.Tech / B.E.,Get Fee Details,-,
Aryavart Institute of Technology & Management,4.2,UTTAR PRADESH,B.Tech / B.E.,Get Fee Details,UPSEE,
Guru Nanak Education Trust Group of Institutions,4.2,UTTARAKHAND,B.Tech / B.E.,Get Fee Details,"UK SEE, JEE Main",
Institute of Technology,4.2,UTTARAKHAND,B.Tech / B.E.,Get Fee Details,"UK SEE, JEE Main",
"Pankaj Laddhad Institute of Technology and Management Studies, Buldana ,Maharashtra - Other",4.2,MAHARASHTRA,B.Tech / B.E.,"₹2,00,000",-,10
Gajamal Tulsiram Patil College,4,MAHARASHTRA,B.Tech / B.E.,"₹3,60,000",-,
"Mangalmay Institute of Engineering and Technology ,Greater Noida",4.2,UTTAR PRADESH,B.Tech / B.E.,"₹3,02,000",-,
Sambharam Group of Institutions,4.2,KARNATAKA,B.Tech / B.E.,Get Fee Details,-,
"Engineering College, Dholpur ,Bharatpur",4.2,RAJASTHAN,B.Tech / B.E.,"₹1,96,000",-,30
Vyas College of Engineering & Technology,4.2,RAJASTHAN,B.Tech / B.E.,"₹2,89,000",-,
IASSCOM Fortune Institute of Technology,2,MADHYA PRADESH,B.Tech / B.E.,"₹1,82,500",-,
Seemant Institute of Technology,4.2,UTTARAKHAND,B.Tech / B.E.,Get Fee Details,-,
Atmiya University,3,GUJARAT,B.Tech / B.E.,"₹3,24,000",-,10
Laxmi Narayan Institute of Technology - Gwalior,4.7,MADHYA PRADESH,B.Tech / B.E.,Get Fee Details,PET Madhya Pradesh,
"Eluru College of Engineering and Technology (ECET, Eluru) ,West Godavari",4.2,ANDHRA PRADESH,B.Tech / B.E.,"₹1,40,000",-,
Yadhuvanshi College of Engineering & Technology - Sohali,4,RAJASTHAN,B.Tech / B.E.,"₹2,10,000",-,
"OmDayal Group of Institutions ,Uluberia Palara, Kolkata",4.2,WEST BENGAL,B.Tech / B.E.,"₹2,29,000",-,
Rajeev Institute of Technology - Hassan,3,KARNATAKA,B.Tech / B.E.,Get Fee Details,-,
Rukmani Devi Institute of Science & Technology,4.2,MADHYA PRADESH,B.Tech / B.E.,Get Fee Details,-,
RKDF College of Engineering,4.8,MADHYA PRADESH,B.Tech / B.E.,Get Fee Details,PET Madhya Pradesh,
Noble Group of Institutions,4.3,GUJARAT,B.Tech / B.E.,Get Fee Details,GUJCET,
Gyan Ganga Institute of Technology & Management,3.7,MADHYA PRADESH,B.Tech / B.E.,Get Fee Details,PET Madhya Pradesh,
"Elizabeth College of Engineering and Technology ,Tamil Nadu - Other",4.2,TAMIL NADU,B.Tech / B.E.,"₹2,00,000",-,24
Jaipur Institute of Engineering & Technology,5,RAJASTHAN,B.Tech / B.E.,"₹2,80,000",-,
Dr Nagarathinam College of Engineering,4.2,TAMIL NADU,B.Tech / B.E.,"₹2,00,000",-,
Vindhya Institute of Technology & Science,4.2,MADHYA PRADESH,B.Tech / B.E.,Get Fee Details,-,
C U Shah College of Engineering & Technology,5,GUJARAT,B.Tech / B.E.,Get Fee Details,-,
Jai Narain College of Technology,1,MADHYA PRADESH,B.Tech / B.E.,Get Fee Details,"PET Madhya Pradesh, CG PET",
"KJ's Educational Institute ,Kondhwa, Pune",4.2,MAHARASHTRA,B.Tech / B.E.,"₹3,31,000",-,
Institute of Technology - Gopeshwar,4,UTTARAKHAND,B.Tech / B.E.,"₹2,10,000",-,
