college_name,rating,location,courses_offered,tution_fee,exams_accepted,highest_package
IIT Madras (IITM),4.4,Tamil Nadu,B.Tech / B.E.,"₹ 8,92,000","JEE Advanced , JEE Main",95
Indian Institute of Technology (IITD),4,Delhi NCR,B.Tech / B.E.,"₹ 7,44,500","JEE Advanced , JEE Main",200
Indian Institute of Technology Bombay (IITB)- IIT Bombay,3.3,Maharashtra,B.Tech / B.E.,"₹ 12,96,500","JEE Advanced , JEE Main",367
"Indian Institute of Technology (IIT), Kanpur, Uttar Pradesh",4.1,Uttar Pradesh,B.Tech / B.E.,"₹ 7,96,500","JEE Advanced , JEE Main",99
Indian Institute of Technology- IIT Kharagpur (IITKGP),4.3,West Bengal,B.Tech / B.E.,"₹ 8,94,000","JEE Advanced , JEE Main",214
Indian Institute of Technology (IIT) Roorkee,4.9,Uttarakhand,B.Tech / B.E.,"₹ 6,80,000","JEE Advanced , JEE Main",130
IIT Hyderabad,4,Telangana,B.Tech / B.E.,"₹ 8,87,000","JEE Advanced , JEE Main",69
Indian Institute of Technology- IIT Guwahati,4.6,Assam,B.Tech / B.E.,"₹ 9,15,500","JEE Advanced , JEE Main",205
National Institute of Technology (NIT) Trichy,4.4,Tamil Nadu,B.Tech / B.E.,"₹ 8,69,000","JEE Main , JEE Advanced",70
IIT BHU,4.4,Uttar Pradesh,B.Tech / B.E.,"₹ 8,49,500","JEE Advanced , JEE Main",200
Birla Institute of Technology and Science (BITS),4.5,Telangana,B.Tech / B.E.,"₹ 10,00,000",BITSAT,61
Indian Institute of Technology (IIT),5,Madhya Pradesh,B.Tech / B.E.,"₹ 8,35,000","JEE Advanced , JEE Main",45
National Institute of Technology (NIT Rourkela),4.6,Odisha,B.Tech / B.E.,"₹ 6,46,000","JEE Main , JEE Advanced",85
SRM Institute of Science and Technology - SRM University,3.6,Uttar Pradesh,B.Tech / B.E.,Get Fee Details,SRMJEEE,22
Indian Institute of Technology (Indian School of Mines) (ISM),4.2,Jharkhand,B.Tech / B.E.,"₹ 4,13,000","JEE Advanced , JEE Main",25
Vellore Institute of Technology - Chennai (VIT Chennai),4.1,Tamil Nadu,B.Tech / B.E.,"₹ 6,67,500","JEE Main , VITEEE",65
National Institute of Technology (NIT) - Surathkal,4.8,Karnataka,B.Tech / B.E.,"₹ 5,46,500","JEE Main , JEE Advanced",31
Jadavpur University,4.5,West Bengal,B.Tech / B.E.,"₹ 27,000",WBJEE,140
Indian Institute of Technology (IIT),5,Bihar,B.Tech / B.E.,"₹ 8,56,000","JEE Advanced , JEE Main",39
Anna University - Chennai,4.1,Tamil Nadu,B.Tech / B.E.,"₹ 7,33,500",-,
Institute of Chemical Technology (ICT),3.4,Maharashtra,B.Tech / B.E.,"₹3,24,000","JEE Main, Maharashtra CET",10
Malaviya National Institute of Technology (MNIT),4.6,Rajasthan,B.Tech / B.E.,"₹6,72,000","JEE Main, JEE Advanced",60
UPES,3.9,Uttarakhand,B.Tech / B.E.,"₹11,12,000","JEE Main,",17
Visvesvaraya National Institute of Technology (VNIT),3.9,Maharashtra,B.Tech / B.E.,"₹5,00,000","JEE Main, JEE Advanced",12
Symbiosis International University (SIU),4,Maharashtra,B.Tech / B.E.,"₹2,90,000",-,
Sri Sivasubramaniya Nadar College of Engineering,3.7,Tamil Nadu,B.Tech / B.E.,Get Fee Details,JEE Main,10
Lovely Professional University,4.1,Punjab,B.Tech / B.E.,"₹14,40,000",-,
National Institute of Technology (NIT),3.7,West Bengal,B.Tech / B.E.,"₹2,66,500","JEE Main, JEE Advanced",51
National Institute of Technology- NIT,3.9,Assam,B.Tech / B.E.,"₹5,38,000","JEE Main, JEE Advanced",55
Birla Institute of Technology (BIT),4,Rajasthan,B.Tech / B.E.,Get Fee Details,JEE Main,10
Graphic Era University,3.4,Uttarakhand,B.Tech / B.E.,"₹9,67,000",JEE Main,12
National Institute of Technology (NIT),4,Bihar,B.Tech / B.E.,"₹5,26,500","JEE Main, JEE Advanced",54
Indian Institute of Engineering Science and Technology (IIEST),4.4,West Bengal,B.Tech / B.E.,"₹5,21,000",JEE Main,56
Dr BR Ambedkar National Institute of Technology (NIT),3.4,Punjab,B.Tech / B.E.,"₹4,74,000","JEE Main, JEE Advanced",42
Indian Institute of Technology Jammu,5,Jammu & Kashmir,B.Tech / B.E.,"₹10,00,000","JEE Advanced, JEE Main",
Indian Institute of Technology Tirupati,5,Andhra Pradesh,B.Tech / B.E.,"₹4,34,500","JEE Advanced, JEE Main",46
Manipal University,4.3,Rajasthan,B.Tech / B.E.,"₹9,77,500",MU OET,27
Manipal Institute of Technology,4.5,Karnataka,B.Tech / B.E.,"₹4,26,500",MET Exam,51
Madan Mohan Malaviya University of Technology,4,Uttar Pradesh,B.Tech / B.E.,"₹6,00,000",UPSEE,
Indian Institute of Space Science and Technology,4,Kerala,B.Tech / B.E.,"₹3,87,000",Highest Package,17
National Institute of Technology,4,Jharkhand,B.Tech / B.E.,"₹6,28,000","JEE Main, JEE Advanced",85
National Institute of Technology (NIT),4.1,Meghalaya,B.Tech / B.E.,"₹7,64,000","JEE Main, JEE Advanced",11
Jain University,3.6,Karnataka,B.Tech / B.E.,"₹8,47,000",-,
National Institute of Technology (NIT),4.2,Haryana,B.Tech / B.E.,"₹5,91,000","JEE Main, JEE Advanced",44
NIT Raipur,4.7,Chattisgarh,B.Tech / B.E.,"₹2,40,000","JEE Main, JEE Advanced",
Vel Tech Multi Tech Dr Rangarajan Dr Sakunthala Engineering College,3.4,Tamil Nadu,B.Tech / B.E.,Get Fee Details,TNEA,
Andhra University College of Engineering,3.6,Andhra Pradesh,B.Tech / B.E.,Get Fee Details,AP EAMCET,8
Chitkara University,4.1,Punjab,B.Tech / B.E.,"₹10,17,500",JEE Main,55
College of Engineering (COEP),4.2,Maharashtra,B.Tech / B.E.,"₹5,69,000",Maharashtra CET,39
SR University,4,Telangana,B.Tech / B.E.,"₹4,60,000","JEE Main, JEE Main, JEE Advanced",34
Panjab University,4.5,Punjab,B.Tech / B.E.,"₹4,30,000",JEE Main,
Jawaharlal Nehru Technological University (JNTUH),4,Telangana,B.Tech / B.E.,"₹2,00,000",JEE Main,15
CV Raman Global University,4.1,Odisha,B.Tech / B.E.,"₹2,36,000","JEE Main, OJEE",14
Indian Institute of Information Technology and Management - IIITM,3.9,Madhya Pradesh,B.Tech / B.E.,Get Fee Details,JEE Main,26
National Institute of Technology (NIT),4.4,Himachal Pradesh,B.Tech / B.E.,"₹5,01,000","JEE Main, JEE Advanced",112
Pandit Deendayal Energy University (PDEU),4.4,Gujarat,B.Tech / B.E.,"₹9,97,000",JEE Main,19
National Institute of Technology (NIT) - Puducherry,2.7,Puducherry,B.Tech / B.E.,"₹2,01,500","JEE Main, JEE Advanced",44
Sri Krishna College of Engineering and Technology - SKCET,3.6,Tamil Nadu,B.Tech / B.E.,"₹2,20,000",TNEA,8
Institute of Engineering and Management,4,WEST BENGAL,B.Tech / B.E.,"₹4,00,000",JEE Main,10
Dr MGR educational and research institute,4.2,TAMIL NADU,B.Tech / B.E.,"₹3,20,000",-,
Dr MGR educational and research institute,4.2,TAMIL NADU,B.Tech / B.E.,"₹3,20,000",-,
Vellore Institute of Technology - VIT University,4.1,TAMIL NADU,B.Tech / B.E.,"₹7,16,500",JEE Main,120
Birla Institute of Technology - BIT Mesra,3.7,JHARKHAND,B.Tech / B.E.,"₹10,00,000",JEE Main,27
Alliance University,3.8,KARNATAKA,B.Tech / B.E.,"₹11,09,000",JEE Main,18
KJ Somaiya College of Engineering (KJSCE),4.1,MAHARASHTRA,B.Tech / B.E.,"₹11,44,000","Maharashtra CET, JEE Main",13
Nirma University - [NU],4.1,GUJARAT,B.Tech / B.E.,"₹6,44,000",JEE Main,88
Hindustan University,4.1,TAMIL NADU,B.Tech / B.E.,"₹10,00,000",Highest Package,15
KL University (KLU),4,ANDHRA PRADESH,B.Tech / B.E.,"₹10,20,500",JEE Main,57
Indira Gandhi Delhi Technical University for Women (IGDTUW),3.3,DELHI NCR,B.Tech / B.E.,"₹5,24,000",JEE Main,70
National Institute of Technology (NIT) - Uttarakhand,4.2,UTTARAKHAND,B.Tech / B.E.,"₹2,57,500","JEE Main, JEE Advanced",
SRM University Chennai (SRM Institute of Science and Technology),3.9,TAMIL NADU,B.Tech / B.E.,"₹10,10,000",SRMJEEE,42
Harcourt Butler Technological University (HBTU),4.3,UTTAR PRADESH,B.Tech / B.E.,"₹3,33,000","JEE Main, CUET, UPSEE",9
VNR Vignana Jyothi Institute of Engineering & Technology,3.9,TELANGANA,B.Tech / B.E.,"₹5,40,000","AP EAMCET, JEE Main",10
Dayananda Sagar College of Engineering (DSCE),4.1,KARNATAKA,B.Tech / B.E.,"₹2,54,500",KCET,30
KIET Group of Institutions,4.5,UTTAR PRADESH,B.Tech / B.E.,"₹4,82,000",JEE Main,32
National Institute of Engineering (NIE),4.5,KARNATAKA,B.Tech / B.E.,"₹5,87,500",KCET,29
Govt Model Engineering College (MEC),5,KERALA,B.Tech / B.E.,"₹1,22,500",KEAM,24
Bannari Amman Institute of Technology,4.2,TAMIL NADU,B.Tech / B.E.,"₹2,98,000",TNEA,26
BMS College of Engineering (BMSCE),4.1,KARNATAKA,B.Tech / B.E.,"₹3,50,000","COMEDK UGET, KCET",45
Mepco Schlenk Engineering College,4.1,TAMIL NADU,B.Tech / B.E.,"₹1,80,000",TNEA,14
National Institute of Technology- NIT,4.5,Kerala,B.Tech / B.E.,"₹5,47,000","JEE Main, JEE Advanced",16
Siksha O Anusandhan University (SOA),3.2,Odisha,B.Tech / B.E.,Get Fee Details,JEE Main,22
Amrita Vishwa Vidyapeetham University,4.2,Tamil Nadu,B.Tech / B.E.,"₹19,40,000",JEE Main,5
Jamia Millia Islamia University,4.2,Delhi NCR,B.Tech / B.E.,"₹64,500",-,20
Indian Institute Of Technology,1,Gujarat,B.Tech / B.E.,"₹8,71,000","JEE Advanced, JEE Main",62
Indian Institute of Technology- IIT Mandi,4,Himachal Pradesh,B.Tech / B.E.,"₹7,84,000","JEE Advanced, JEE Main",26
Indian Institute of Technology (IIT),4.2,Rajasthan,B.Tech / B.E.,"₹1,14,000","JEE Advanced, JEE Main",57
National institute of Technology (NIT) Warangal,3.9,Telangana,B.Tech / B.E.,"₹5,00,000","JEE Main, JEE Advanced",14
Thapar Institute of Engineering and Technology,4.5,Punjab,B.Tech / B.E.,"₹10,00,000",JEE Main,55
Delhi Technological University (DTU),4.3,Delhi NCR,B.Tech / B.E.,"₹3,36,000",JEE Main,39
Chandigarh University (CU),4.3,Punjab,B.Tech / B.E.,Get Fee Details,-,
Indian Institute of Technology,5,Punjab,B.Tech / B.E.,"₹8,12,000","JEE Advanced, JEE Main",55
Kalasalingam University,3.9,Tamil Nadu,B.Tech / B.E.,"₹4,00,000",TNEA,
Aligarh Muslim University,4.5,Uttar Pradesh,B.Tech / B.E.,Get Fee Details,-,
Koneru Lakshmaiah Education Foundation,4.4,Andhra Pradesh,B.Tech / B.E.,"₹9,90,000",-,
Kalinga Institute of Industrial Technology (KIIT),4.3,Odisha,B.Tech / B.E.,"₹9,43,000",JEE Main,63
"Amity University, Noida",4,Uttar Pradesh,B.Tech / B.E.,"₹13,64,500",JEE Main,18
International Institute of Information Technology (IIIT) - Hyderabad (IIIT Hyderabad),4,Telangana,B.Tech / B.E.,Get Fee Details,JEE Main,45
Indian Institute of Technology- IIT Bhubaneswar,5,Odisha,B.Tech / B.E.,"₹9,35,000","JEE Advanced, JEE Main",39
Shanmugha Arts Science Technology & Research Academy (SASTRA University),3.8,Tamil Nadu,B.Tech / B.E.,"₹5,30,000",JEE Main,15
Motilal Nehru National Institute of Technology (MNNIT),4.2,Uttar Pradesh,B.Tech / B.E.,"₹2,96,000","JEE Main, JEE Advanced",11
Indraprastha Institute of Information Technology (IIIT),4.7,Delhi NCR,B.Tech / B.E.,"₹4,00,000",JEE Main,71
Indian Institute of Technology Palakkad,5,Kerala,B.Tech / B.E.,"₹8,00,000","JEE Advanced, JEE Main",46
National Institute of Technology (NIT),4,Delhi NCR,B.Tech / B.E.,"₹1,08,000","JEE Main, JEE Advanced",82
Sardar Vallabhbhai National Institute of Technology,4.4,Gujarat,B.Tech / B.E.,Get Fee Details,"JEE Main, JEE Advanced",44
Sathyabama Institute of Science and Technology,3,Tamil Nadu,B.Tech / B.E.,"₹7,55,000",JEE Main,4
PSG College of Technology (PSGCT),4.6,Tamil Nadu,B.Tech / B.E.,"₹2,20,000",TNEA,35
International Institute of Information Technology (IIIT),4,Karnataka,B.Tech / B.E.,"₹3,82,000","KCET, JEE Main, COMEDK UGET",130
Netaji Subhas University of Technology - NSUT,4.1,Delhi NCR,B.Tech / B.E.,"₹8,44,000",JEE Main,27
Banasthali Vidyapith,4.5,Rajasthan,B.Tech / B.E.,"₹5,74,500",JEE Main,5
Indian Institute of Technology (IIT Bhilai),4.2,Chattisgarh,B.Tech / B.E.,"₹8,83,500","JEE Main, JEE Main, JEE Advanced",
National Institute of Technology (NIT),4.1,Jammu & Kashmir,B.Tech / B.E.,"₹3,10,000","JEE Main, JEE Advanced",72
University of Hyderabad,4.2,Telangana,B.Tech / B.E.,"₹80,000",JEE Main,23
MS Ramaiah Institute of Technology (MSRIT),3.9,Karnataka,B.Tech / B.E.,"₹4,48,500","KEAM, COMEDK UGET",50
Christ University (CU),4.1,Karnataka,B.Tech / B.E.,"₹8,12,500","KEAM, COMEDK UGET",36
Indian Institute of Information Technology (IIIT Dharwad),3.3,Karnataka,B.Tech / B.E.,"₹10,00,000",JEE Main,
Rajiv Gandhi Institute of Petroleum Technology,4.2,Uttar Pradesh,B.Tech / B.E.,Get Fee Details,JEE Main,
Sant Longowal Institute of Engineering & Technology,4,Punjab,B.Tech / B.E.,"₹4,24,000",JEE Main,19
Vignans Foundation for Science Technology and Research,3.4,Andhra Pradesh,B.Tech / B.E.,"₹10,40,000","AP EAMCET, JEE Main,",44
Maulana Azad National Institute of Technology (MANIT),4,Madhya Pradesh,B.Tech / B.E.,"₹2,33,000","JEE Main, JEE Advanced",24
Bannari Amman Institute of Technology,4.2,TAMIL NADU,B.Tech / B.E.,"₹2,98,000",TNEA,26
Chaitanya Bharathi Institute of Technology,4.2,TELANGANA,B.Tech / B.E.,"₹5,60,000","AP EAMCET, JEE Main",8
Zakir Husain College of Engineering & Technology,4.5,UTTAR PRADESH,B.Tech / B.E.,"₹72,000",-,6
CVR College of Engineering,4,TELANGANA,B.Tech / B.E.,"₹7,50,000","AP EAMCET, JEE Main",58
Birla Institute of Technology and Science - BITS,3.9,RAJASTHAN,B.Tech / B.E.,"₹12,91,500",BITSAT,133
PES College of Engineering - PESCE,3.7,KARNATAKA,B.Tech / B.E.,"₹8,80,000",KCET,9
GL Bajaj Institute of Technology and Management,4.2,UTTAR PRADESH,B.Tech / B.E.,"₹2,40,000",JEE Main,
Vishwakarma Institute of Information Technology (VIIT),4.1,MAHARASHTRA,B.Tech / B.E.,"₹7,37,500",JEE Main,41
Bharati Vidyapeeth University College of Engineering,3.7,MAHARASHTRA,B.Tech / B.E.,"₹3,96,000",JEE Main,12
MLR Institute of Technology,3.9,TELANGANA,B.Tech / B.E.,"₹2,80,000","AP EAMCET, JEE Main",10
CMR College of Engineering & Technology,4.4,TELANGANA,B.Tech / B.E.,"₹3,00,000","AP EAMCET, JEE Main",58
Army Institute of Technology,3.1,MAHARASHTRA,B.Tech / B.E.,"₹8,44,000",JEE Main,39
RMK College of Engineering and Technology,3.8,TAMIL NADU,B.Tech / B.E.,"₹2,76,500",TNEA,7
Maharaja Surajmal Institute of Technology (MSIT),3.8,DELHI NCR,B.Tech / B.E.,"₹5,75,500",JEE Main,39
Galgotias University,4,UTTAR PRADESH,B.Tech / B.E.,"₹6,57,000",JEE Main,10
The NorthCap University - [NCU],4,HARYANA,B.Tech / B.E.,"₹9,84,000",JEE Main,31
Cummins College of Engineering for Women,4.3,MAHARASHTRA,B.Tech / B.E.,"₹6,73,500",JEE Main,10
Vidya Jyothi Institute of Technology (VJIT),3.9,TELANGANA,B.Tech / B.E.,"₹4,60,000",AP EAMCET,8
Chandigarh Group of Colleges - Landran (CGC Landran),4.2,PUNJAB,B.Tech / B.E.,"₹5,76,000",JEE Main,55
MVSR Engineering College,4.1,TELANGANA,B.Tech / B.E.,"₹4,84,000",AP EAMCET,15
VR Siddhartha Engineering College,4,ANDHRA PRADESH,B.Tech / B.E.,"₹4,48,000",AP EAMCET,45
Sikkim Manipal University,3.7,SIKKIM,B.Tech / B.E.,"₹6,16,000",MU OET,
Vivekananda Global University- VGU,4.6,RAJASTHAN,B.Tech / B.E.,"₹6,57,000",JEE Main,10
GMR Institute of Technology,2.9,ANDHRA PRADESH,B.Tech / B.E.,"₹4,56,000",AP EAMCET,11
Malla Reddy College of Engineering & Technology,4.1,TELANGANA,B.Tech / B.E.,Get Fee Details,"AP EAMCET, JEE Main",56
Galgotias College of Engineering & Technology (GCET),4.2,UTTAR PRADESH,B.Tech / B.E.,"₹4,54,500","JEE Main, UPSEE",12
KCG College of Technology,4.2,TAMIL NADU,B.Tech / B.E.,"₹2,20,000",TNEA,9
AMC Engineering College (AMCEC),3.7,KARNATAKA,B.Tech / B.E.,"₹5,00,000","COMEDK UGET, JEE Main,",21
Reva University,4.2,KARNATAKA,B.Tech / B.E.,"₹6,91,500",CUET,14
KLS Gogte Institute of Technology,1,KARNATAKA,B.Tech / B.E.,"₹3,86,000",KCET,
JIS College of Engineering,4.3,WEST BENGAL,B.Tech / B.E.,"₹4,06,500","JEE Main, WBJEE",8
RMD Engineering College,3.8,TAMIL NADU,B.Tech / B.E.,Get Fee Details,TNEA,
Maharishi Markandeshwar University - MMU,3.8,HARYANA,B.Tech / B.E.,"₹3,91,000",JEE Main,24
Heritage Institute of Technology,4,WEST BENGAL,B.Tech / B.E.,"₹5,08,000","JEE Main, WBJEE",3
GH Raisoni College of Engineering,3.7,MAHARASHTRA,B.Tech / B.E.,"₹1,10,000",JEE Main,8
Rajeev Gandhi Memorial College of Engineering and technology (RGMCET),3.8,ANDHRA PRADESH,B.Tech / B.E.,"₹3,04,000",AP EAMCET,7
Shri Vishnu Engineering College for Women,5,ANDHRA PRADESH,B.Tech / B.E.,"₹3,08,000",AP EAMCET,
Muffakham Jah College of Engineering & Technology,3.6,TELANGANA,B.Tech / B.E.,"₹4,40,000",AP EAMCET,
Siddhartha Institute of Engineering and Technology,3.8,TELANGANA,B.Tech / B.E.,Get Fee Details,AP EAMCET,12
Narula Institute of Technology,4.2,WEST BENGAL,B.Tech / B.E.,"₹4,08,000","WBJEE, JEE Main",6
DY Patil College of Engineering (DYPCOE),4.4,MAHARASHTRA,B.Tech / B.E.,"₹5,36,000",Maharashtra CET,45
Noorul Islam University,1.5,TAMIL NADU,B.Tech / B.E.,"₹2,60,000",-,
Amity University- Mumbai,4.1,MAHARASHTRA,B.Tech / B.E.,"₹10,26,000","JEE Main, CUET",30
Jawaharlal Nehru National College of Engineering,4,KARNATAKA,B.Tech / B.E.,"₹3,86,000",-,
Ajay Kumar Garg Engineering College,3.8,UTTAR PRADESH,B.Tech / B.E.,Get Fee Details,UPSEE,20
ISB&M School of Technology,5,MAHARASHTRA,B.Tech / B.E.,"₹3,52,000",JEE Main,11
ICFAI Tech School (ICFAI Hyderabad),4,TELANGANA,B.Tech / B.E.,"₹8,05,000",Highest Package,14
AISSMS College of Engineering,4.2,MAHARASHTRA,B.Tech / B.E.,"₹4,42,500","JEE Main, Maharashtra CET",12
NSHM Knowledge Campus (Durgapur),4.2,WEST BENGAL,B.Tech / B.E.,"₹3,04,000",-,
Stanley College of Engineering & Technology for Women,5,TELANGANA,B.Tech / B.E.,Get Fee Details,AP EAMCET,
National Institute of Technology (NIT),4.5,TRIPURA,B.Tech / B.E.,"₹5,33,500","JEE Main, JEE Advanced",52
Velammal Institute of Technology,4.2,TAMIL NADU,B.Tech / B.E.,Get Fee Details,TNEA,
Gandhi Institute of Engineering and Technology,4.8,ODISHA,B.Tech / B.E.,"₹5,40,000",JEE Main,8
Veltech Dr.RR & Dr.SR University,4,TAMIL NADU,B.Tech / B.E.,"₹7,60,000",TNEA,7
Indian Institute of Information Technology (IIIT),4.2,UTTAR PRADESH,B.Tech / B.E.,"₹6,29,500",JEE Main,65
Chhatrapati Shivaji Maharaj University,4.2,MAHARASHTRA,B.Tech / B.E.,"₹5,10,000",-,
Saraswati College of Engineering - Khargar,4.8,MAHARASHTRA,B.Tech / B.E.,"₹4,60,000",Maharashtra CET,12
Guru Gobind Singh Indraprastha University (IPU),3.9,DELHI NCR,B.Tech / B.E.,"₹4,69,000",-,
Jaipur Engineering College & Research Centre,4.3,RAJASTHAN,B.Tech / B.E.,"₹80,500","RPET, JEE Main",10
Velammal College of Engineering and Technology,1,TAMIL NADU,B.Tech / B.E.,"₹2,00,000",TNEA,9
Sagi Ramakrishnam Raju Engineering College - SRKR,4.2,ANDHRA PRADESH,B.Tech / B.E.,"₹2,65,500",AP EAMCET,47
Galgotias University,4,UTTAR PRADESH,B.Tech / B.E.,"₹6,57,000",JEE Main,10
Chandigarh Group of Colleges - Landran (CGC Landran),4.2,PUNJAB,B.Tech / B.E.,"₹5,76,000",JEE Main,55
The NorthCap University - [NCU],4,HARYANA,B.Tech / B.E.,"₹9,84,000",JEE Main,31
MVSR Engineering College,4.1,TELANGANA,B.Tech / B.E.,"₹4,84,000",AP EAMCET,15
Cummins College of Engineering for Women,4.3,MAHARASHTRA,B.Tech / B.E.,"₹6,73,500",JEE Main,10
Sona College of Technology,3.5,TAMIL NADU,B.Tech / B.E.,"₹1,94,500",TNEA,7
Manav Rachna International Institute of Research and Studies,4,HARYANA,B.Tech / B.E.,"₹7,35,000","JEE Main, MRNAT",12
GLA University,4.3,UTTAR PRADESH,B.Tech / B.E.,"₹4,63,000",Highest Package,11
Dwarakadas J Sanghvi College of Engineering,4.4,MAHARASHTRA,B.Tech / B.E.,"₹7,65,000",Maharashtra CET,38
Rajalakshmi Engineering College (REC),4.1,TAMIL NADU,B.Tech / B.E.,"₹1,74,000",TNEA,12
Shri Ramdeobaba college of Engineering and Management,4.3,MAHARASHTRA,B.Tech / B.E.,"₹5,48,500",JEE Main,20
G Pulla Reddy Engineering College,4.4,ANDHRA PRADESH,B.Tech / B.E.,"₹3,20,000",AP EAMCET,10
SDM College of Engineering & Technology,4.3,KARNATAKA,B.Tech / B.E.,"₹3,86,000",KCET,
Sri Sairam Engineering College,4.8,TAMIL NADU,B.Tech / B.E.,"₹2,00,000",TNEA,9
RVR and JC College of Engineering - RVRJCCE,3.5,ANDHRA PRADESH,B.Tech / B.E.,"₹6,07,500","AP EAMCET, JEE Main",52
Pimpri Chinchwad College of Engineering,4,MAHARASHTRA,B.Tech / B.E.,"₹3,54,500","JEE Main, Maharashtra CET",8
Nitte Meenakshi Institute of Technology - NMIT,4.6,KARNATAKA,B.Tech / B.E.,"₹2,14,000","COMEDK UGET, KCET",15
Sikkim Manipal University,3.7,SIKKIM,B.Tech / B.E.,"₹6,16,000",MU OET,
VR Siddhartha Engineering College,4,ANDHRA PRADESH,B.Tech / B.E.,"₹4,48,000",AP EAMCET,45
Presidency University,4,KARNATAKA,B.Tech / B.E.,"₹10,00,000",-,
Fr Conceicao Rodrigues College of Engineering,3.2,MAHARASHTRA,B.Tech / B.E.,"₹5,64,000",Maharashtra CET,35
Cambridge Engineering College,3.5,KARNATAKA,B.Tech / B.E.,Get Fee Details,-,
HKBK College of Engineering,3.1,KARNATAKA,B.Tech / B.E.,"₹5,76,000",KCET,6
Shah & Anchor Kutchhi Engineering College,3.5,MAHARASHTRA,B.Tech / B.E.,"₹3,40,000",Maharashtra CET,
SIES Graduate School of Technology,4,MAHARASHTRA,B.Tech / B.E.,"₹5,84,000",-,
Chandigarh Group of Colleges - Jhanjeri (CGC Jhanjeri),4.1,PUNJAB,B.Tech / B.E.,"₹5,14,500",JEE Main,32
Amity University-Lucknow,4.2,UTTAR PRADESH,B.Tech / B.E.,"₹10,59,000",-,45
Shri Ram Institute of Technology,5,MADHYA PRADESH,B.Tech / B.E.,Get Fee Details,JEE Main,
Guru Nanak Institute of Technology (GNIT) - Kolkata,4.6,WEST BENGAL,B.Tech / B.E.,Get Fee Details,WBJEE,
Dr DY Patil Institute of Technology,4.2,MAHARASHTRA,B.Tech / B.E.,"₹4,07,000","JEE Main, Maharashtra CET",
MIT World Peace University - MIT WPU,4.2,MAHARASHTRA,B.Tech / B.E.,"₹4,19,000",JEE Main,44
CMR Technical Campus,3.8,TELANGANA,B.Tech / B.E.,"₹3,20,000",-,
Maulana Abul Kalam Azad University of Technology,4.4,WEST BENGAL,B.Tech / B.E.,Get Fee Details,-,
Anurag University,4.2,TELANGANA,B.Tech / B.E.,"₹5,00,000",-,
Sharda University,4.3,UTTAR PRADESH,B.Tech / B.E.,"₹8,45,000",Highest Package,20
Annamalai University,4,TAMIL NADU,B.Tech / B.E.,Get Fee Details,-,
Vallurupalli Nageswara Rao Vignana Jyothi Institute Of Engineering and Technology,3,TELANGANA,B.Tech / B.E.,"₹1,38,000",-,
Jaypee Institute of Information Technology - JIIT,4,UTTAR PRADESH,B.Tech / B.E.,"₹14,03,500",JEE Main,82
Gandhi Institute For Technological Advancement (GITA Bhubaneswar),4.5,ODISHA,B.Tech / B.E.,Get Fee Details,-,
Shri Vishnu Engineering College for Women,5,ANDHRA PRADESH,B.Tech / B.E.,"₹3,08,000",AP EAMCET,
Chandigarh Engineering College,4.6,PUNJAB,B.Tech / B.E.,Get Fee Details,Amrita Entrance Examination (AEE),
Muffakham Jah College of Engineering & Technology,3.6,TELANGANA,B.Tech / B.E.,"₹4,40,000",AP EAMCET,
Vels University (VU),3.3,TAMIL NADU,B.Tech / B.E.,"₹5,40,000",Highest Package,
CMR Institute of Technology,4.5,KARNATAKA,B.Tech / B.E.,Get Fee Details,KCET,
GH Raisoni College of Engineering,3.7,MAHARASHTRA,B.Tech / B.E.,"₹1,10,000",JEE Main,8
Siddhartha Institute of Engineering and Technology,3.8,TELANGANA,B.Tech / B.E.,Get Fee Details,AP EAMCET,12
Thangal Kunju Musaliar College of Engineering (TKMCOE),3,KERALA,B.Tech / B.E.,"₹4,03,000",KEAM,
Geethanjali College of Engineering and Technology,4.1,TELANGANA,B.Tech / B.E.,"₹3,29,500",AP EAMCET,
International Institute of Information Technology (IIIT),4.5,ODISHA,B.Tech / B.E.,"₹9,01,000",JEE Main,9
Vignan Institute of Technology and Science (VITS),4.2,TELANGANA,B.Tech / B.E.,"₹2,92,000",AP EAMCET,
Amity University - Haryana,4.1,HARYANA,B.Tech / B.E.,"₹10,61,000",JEE Main,45
University of Engineering & Management (UEM) Jaipur,3.9,RAJASTHAN,B.Tech / B.E.,"₹4,68,000",-,72
Amity School of Engineering and Technology (ASET),3.2,DELHI NCR,B.Tech / B.E.,"₹10,00,000",JEE Main,
JSS Science and Technology University,4.5,KARNATAKA,B.Tech / B.E.,"₹4,24,000",KCET,6
KS Rangasamy College of Technology,4.3,TAMIL NADU,B.Tech / B.E.,"₹2,20,000",-,
Ramrao Adik Institute of Technology,4.2,MAHARASHTRA,B.Tech / B.E.,"₹10,00,000",JEE Main,15
Lakshmi Narain College of Technology,3.7,MADHYA PRADESH,B.Tech / B.E.,Get Fee Details,JEE Main,
Sri Krishna College of Technology,4.6,TAMIL NADU,B.Tech / B.E.,Get Fee Details,TNEA,
Vivekanand Education Society's Institute of Technology,4.5,MAHARASHTRA,B.Tech / B.E.,Get Fee Details,-,
Thadomal Shahani Engineering College,2.5,MAHARASHTRA,B.Tech / B.E.,"₹5,67,000",Maharashtra CET,
Sri Krishna College of Technology,4.6,TAMIL NADU,B.Tech / B.E.,Get Fee Details,TNEA,
LNM Institute of Information Technology,3.5,RAJASTHAN,B.Tech / B.E.,"₹10,00,000",JEE Main,
Symbiosis Institute of Technology [SIT],5,MAHARASHTRA,B.Tech / B.E.,"₹9,15,000","JEE Main, Maharashtra CET",37
SA Engineering College,3.8,TAMIL NADU,B.Tech / B.E.,"₹2,00,000",TNEA,12
PSNA College of Engineering and Technology - PSNACET,3.6,TAMIL NADU,B.Tech / B.E.,"₹3,00,000",TNEA,
Sri Sairam Institute of Technology,4.2,TAMIL NADU,B.Tech / B.E.,Get Fee Details,TNEA,
BVRIT Hyderabad College of Engineering for Women,3.9,TELANGANA,B.Tech / B.E.,"₹6,00,000",AP EAMCET,10
IPS Academy,4.1,MADHYA PRADESH,B.Tech / B.E.,"₹4,20,000",PET Madhya Pradesh,12
Amity University - Gwalior,4.2,MADHYA PRADESH,B.Tech / B.E.,"₹7,52,000","JEE Advanced, JEE Main, JEE Main",35
Pranveer Singh Institute of Technology,3.7,UTTAR PRADESH,B.Tech / B.E.,"₹3,16,000","UPSEE, JEE Main",
Amity University - Jaipur,4,RAJASTHAN,B.Tech / B.E.,"₹8,72,000",JEE Main,12
Indian Institute of Information Technology Bhagalpur,5,BIHAR,B.Tech / B.E.,"₹7,92,000",-,
Shobhit University,4.1,UTTAR PRADESH,B.Tech / B.E.,"₹4,20,000",JEE Main,8
NMAM Institute Of Technology,4.5,KARNATAKA,B.Tech / B.E.,Get Fee Details,JEE Main,
National Institute of Science and Technology,3.8,ODISHA,B.Tech / B.E.,"₹2,66,500",JEE Main,19
SRM University - Haryana,4.3,HARYANA,B.Tech / B.E.,"₹5,20,000","GGSIPU CET, JEE Main, SRMJEEE",10
Maharaja Agrasen Institute of Technology (MAIT),4,DELHI NCR,B.Tech / B.E.,"₹7,44,000",JEE Main,12
East Point Group of Institutions,4,KARNATAKA,B.Tech / B.E.,"₹10,00,000",-,
University of Engineering & Management (UEM),3.8,WEST BENGAL,B.Tech / B.E.,"₹6,46,500",JEE Main,16
Annamalai University,4,TAMIL NADU,B.Tech / B.E.,Get Fee Details,-,
MIT World Peace University - MIT WPU,4.2,MAHARASHTRA,B.Tech / B.E.,"₹4,19,000",JEE Main,44
Ganga Institute of Technology & Management,4.5,HARYANA,B.Tech / B.E.,"₹2,80,000",-,5
